{
  "schemaVersion": 1,
  "asOf": "2026-08-11",
  "status": "offline_cryptographic_admission_rehearsal_ready_live_trust_gated",
  "purpose": "Define and rehearse a fail-closed admission envelope for protected A-015 trigger payloads, binding each payload to the live OC-003 parent packet, exact OT-002 or OT-003 consumer packet, workflow target, content digests, source run, bounded time window, ephemeral synthetic issuer signature, and replay key without creating a production identity, trust store, protected path, durable ledger, history store, scheduler, dispatcher, credential, or execution authority.",
  "decisionRefs": ["D-014", "D-017"],
  "riskRefs": ["R-011", "R-013"],
  "workflowRefs": ["A-015", "A-016", "A-017", "A-031", "A-041", "A-042", "A-043", "A-044", "A-045"],
  "authority": {
    "productionEnvelopeAdmissionAuthorized": false,
    "productionPayloadUseAuthorized": false,
    "productionIdentityCreationAuthorized": false,
    "trustStoreConfigurationAuthorized": false,
    "protectedInputBindingAuthorized": false,
    "packetExecutionAuthorized": false,
    "schedulerActivationAuthorized": false,
    "triggerActivationAuthorized": false,
    "networkActivationAuthorized": false,
    "historyPersistenceAuthorized": false,
    "repositoryWriteAuthorized": false,
    "credentialUseAuthorized": false,
    "automatedDispatchAuthorized": false,
    "spendAuthorized": false,
    "externalActionAuthorized": false,
    "conversationIsAuthorization": false
  },
  "packetBinding": {
    "parentSourceId": "OC-003",
    "parentWorkflowId": "A-015",
    "parentPacketIdDerivedFromLiveA042": true,
    "parentPacketContentDigestRequired": true,
    "consumerPacketIdDerivedFromLiveA042": true,
    "consumerPacketContentDigestRequired": true,
    "staleHardCodedPacketIdsPermitted": false,
    "consumers": [
      { "consumerId": "PTC-001", "sourceTriggerId": "OT-002", "targetWorkflowId": "A-016", "targetWorkflowVersion": 1, "syntheticPayloadScenarioId": "PTS-001" },
      { "consumerId": "PTC-002", "sourceTriggerId": "OT-003", "targetWorkflowId": "A-017", "targetWorkflowVersion": 1, "syntheticPayloadScenarioId": "PTS-002" }
    ]
  },
  "cryptographicPolicy": {
    "signatureAlgorithm": "Ed25519",
    "signatureVerificationRequired": true,
    "ephemeralSyntheticKeypairGeneratedPerRehearsal": true,
    "rehearsalKeyIsProductionCredential": false,
    "productionIssuerIdentityConfigured": false,
    "productionVerifierIdentityConfigured": false,
    "productionTrustStoreConfigured": false,
    "keyRotationConfigured": false,
    "keyRevocationConfigured": false,
    "unknownKeyPermitted": false,
    "unsignedEnvelopePermitted": false,
    "signedFields": ["schemaVersion", "envelopeId", "issuedAt", "expiresAt", "issuerIdentityRef", "sourceWorkflowId", "sourceWorkflowVersion", "sourceRunId", "parentPacketId", "parentPacketContentDigestSha256", "consumerPacketId", "consumerPacketContentDigestSha256", "targetWorkflowId", "targetWorkflowVersion", "payloadDigestSha256", "payloadSizeBytes", "payloadContractVersion", "replayKeySha256"]
  },
  "timePolicy": {
    "rehearsalClock": "2026-08-11T10:06:00.000Z",
    "maximumAgeSeconds": 300,
    "maximumClockSkewSeconds": 60,
    "envelopeLifetimeSeconds": 300,
    "trustedTimeConfigured": false,
    "productionMaximumAgeApproved": false,
    "expiredEnvelopePermitted": false,
    "futureEnvelopeBeyondSkewPermitted": false
  },
  "payloadPolicy": {
    "sourceWorkflowId": "A-015",
    "sourceWorkflowVersion": 1,
    "payloadContractVersion": 1,
    "digestAlgorithm": "sha256",
    "digestVerificationRequired": true,
    "byteLengthVerificationRequired": true,
    "schemaValidationRequired": true,
    "syntheticPayloadsOnlyInRehearsal": true,
    "productionPayloadAccepted": false,
    "payloadContentPermittedInAdmissionLog": false
  },
  "replayPolicy": {
    "replayKeyFields": ["sourceRunId", "consumerPacketId", "payloadDigestSha256"],
    "replayKeyAlgorithm": "sha256",
    "exclusiveCreateRequired": true,
    "rehearsalLedgerKind": "operating_system_temporary_exclusive_create_files",
    "rehearsalLedgerOutsideRepositoryRequired": true,
    "rehearsalLedgerEntriesRemovedAfterRun": true,
    "rehearsalLedgerCountsAsProtectedHistory": false,
    "durableReplayStoreConfigured": false,
    "atomicProductionReplayProtectionVerified": false,
    "duplicateEnvelopeBehavior": "reject_before_consumer_invocation"
  },
  "loggingPolicy": {
    "allowedResultFields": ["scenarioId", "expectedDisposition", "actualDisposition", "reasonCode", "signatureVerified", "ledgerWriteCreated"],
    "payloadContentPermitted": false,
    "signatureValuePermitted": false,
    "publicKeyValuePermitted": false,
    "sourceRunIdPermitted": false,
    "payloadPathPermitted": false,
    "repositoryMutationPermitted": false
  },
  "rehearsalPlan": {
    "validScenarioCount": 2,
    "attackScenarioCount": 12,
    "admissionAttemptCount": 14,
    "expectedAcceptedCount": 2,
    "expectedRejectedCount": 12,
    "expectedReplayRejectionCount": 2,
    "expectedEphemeralLedgerWriteCount": 2,
    "consumerInvocationPermitted": false,
    "eligibleCycleCreditPermitted": false,
    "attackScenarios": [
      { "id": "PEA-001", "mutation": "repeat_PTC-001_envelope", "expectedReasonCode": "replay_detected" },
      { "id": "PEA-002", "mutation": "repeat_PTC-002_envelope", "expectedReasonCode": "replay_detected" },
      { "id": "PEA-003", "mutation": "invalid_signature", "expectedReasonCode": "signature_invalid" },
      { "id": "PEA-004", "mutation": "payload_digest_mismatch", "expectedReasonCode": "payload_digest_mismatch" },
      { "id": "PEA-005", "mutation": "payload_size_mismatch", "expectedReasonCode": "payload_size_mismatch" },
      { "id": "PEA-006", "mutation": "expired_envelope", "expectedReasonCode": "envelope_expired" },
      { "id": "PEA-007", "mutation": "issued_beyond_clock_skew", "expectedReasonCode": "issued_in_future" },
      { "id": "PEA-008", "mutation": "source_workflow_mismatch", "expectedReasonCode": "source_workflow_mismatch" },
      { "id": "PEA-009", "mutation": "parent_packet_mismatch", "expectedReasonCode": "parent_packet_mismatch" },
      { "id": "PEA-010", "mutation": "consumer_packet_mismatch", "expectedReasonCode": "consumer_packet_mismatch" },
      { "id": "PEA-011", "mutation": "target_workflow_mismatch", "expectedReasonCode": "target_workflow_mismatch" },
      { "id": "PEA-012", "mutation": "replay_key_mismatch", "expectedReasonCode": "replay_key_mismatch" }
    ]
  },
  "activationGates": [
    { "id": "EA-G01", "gate": "D-017 records the accountable cell, owner, backup, urgent recipient, kill operator, and selected protected-runtime class", "satisfied": false },
    { "id": "EA-G02", "gate": "Separated production issuer and verifier workload identities are configured, attested, least-privileged, and independently reviewed", "satisfied": false },
    { "id": "EA-G03", "gate": "A protected issuer trust store enforces key provenance, rotation, revocation, recovery, expiry, and audit", "satisfied": false },
    { "id": "EA-G04", "gate": "Trusted time and the production maximum envelope age are approved, monitored, and tested against skew and outage", "satisfied": false },
    { "id": "EA-G05", "gate": "A durable atomic replay store rejects concurrent duplicates and survives restart, partition, restoration, and failover", "satisfied": false },
    { "id": "EA-G06", "gate": "Protected payload paths enforce ownership, mode, location, symlink, replacement, cleanup, and lifecycle controls", "satisfied": false },
    { "id": "EA-G07", "gate": "The complete A-015 payload schema and prohibited-field policy are versioned, authenticated, and enforced before admission", "satisfied": false },
    { "id": "EA-G08", "gate": "Live A-042 packet and policy digests are admitted through an independently approved content-addressed packet set", "satisfied": false },
    { "id": "EA-G09", "gate": "Protected parent/child history records only approved metadata and reconciles envelope, packet, payload, identity, outcome, and replay evidence", "satisfied": false },
    { "id": "EA-G10", "gate": "Authenticated high-severity alerts report admission failure without exposing payload, signature, identity, path, or secret material", "satisfied": false },
    { "id": "EA-G11", "gate": "Concurrent admission, ledger partial-write, permission, quota, corruption, restoration, and recovery exercises pass", "satisfied": false },
    { "id": "EA-G12", "gate": "Timeout, cancellation, kill, and orphan-process exercises terminate the entire binder and consumer process tree", "satisfied": false },
    { "id": "EA-G13", "gate": "Runtime tracing confirms zero unexpected network, file, credential, subprocess, write, dispatch, or external effects", "satisfied": false },
    { "id": "EA-G14", "gate": "Independent open-world evaluation covers malformed encodings, parser differentials, oversized input, downgrade, substitution, and denial-of-service cases", "satisfied": false },
    { "id": "EA-G15", "gate": "Four accurate independently reviewed protected shadow cycles reconcile admission and replay outcomes without fallback or duplicate execution", "satisfied": false },
    { "id": "EA-G16", "gate": "Separate expiring approval admits the exact envelope, issuer, verifier, packet, payload, schema, time, replay, history, and effect policies", "satisfied": false }
  ],
  "consumerCount": 2,
  "admissionAttemptCount": 14,
  "expectedAcceptedCount": 2,
  "expectedRejectedCount": 12,
  "configuredProductionIdentityCount": 0,
  "configuredTrustStoreCount": 0,
  "configuredDurableReplayStoreCount": 0,
  "configuredProtectedHistoryCount": 0,
  "satisfiedActivationGateCount": 0,
  "admissionContractReadyForReview": true,
  "productionAdmissionReady": false,
  "consumerInvocationReady": false,
  "externalActionAuthorized": false,